Listing_id,Review_id,Date,Reviewer_name,Comments
40491172,705793646,2020/11/1,Caren,"I donŌĆÖt recommend it. My husband and I spent a 3 days weekend at AllenŌĆÖs place. The place is clean, well furnished and specious. However, the guests donŌĆÖt have control over the temperature and you have to contact the host all the time and beg for the temperature to be turned up. In our last night, host set the temperature to 62 degrees when outside was 34 degrees and he went to sleep. My husband and I were freezing without been able to contact the host because he was sleeping. I had to contact Airbnb at 12am and ask for help. Eventually, Allen turned the temperature down and responded to my messages with only one note: ŌĆ£sorryŌĆ? no explanation whatsoever. I made a complaint to Airbnb and he then explained that the thermostat was broken a couple of weeks ago and he didnŌĆÖt know that it was not properly working. I honestly didnŌĆÖt believe in him, because the temperature would be turned down ever time we left the house and would not be turned up until we request it. Also, loud noises can be heard from upstairs which can be very annoying."
44180048,4.80E+17,2021/10/24,Boone,"Lloyd was very accommodating for our last minute trip. Everything was clean, communication was great, and the place is very conveniently located."
13083497,156100614,2017/5/29,Corey,"Excellent house that is well-labeled with instructions, stocked with extra food and kitchen utensils, and extremely spacious. The downsides were that both toilets easily clogged and nether one of the showers were optimal. Regardless, we would rent here again. "
28722270,661657750,2020/9/7,Kyle,Such an awesome stay! From the character of the loft to the cozy spaces created it was wonderful:)
34330970,754136710,2021/5/2,Mari,Diana is great she is attentive and not intrusive.<br/><br/>She answered all our questions and heads up the location appears as not the greatest but we had no issues there is assigned parking across from the entrance.
44180048,722150100,2021/1/5,Elizabeth & Andrey,"Lloyd, our host was fabulous! So was the apartment! My husband and I loved our stay there. The apartment was immaculate, tastefully decorated and quiet which is very important to me! We will be sure to stay at LloydŌĆÖs place again! No hesitation. Highly recommend!"
24120690,357997583,2018/12/12,Jamie,Such a great place to stay! Has everything you need and host is super friendly and easy to reach! I would definitely stay here again!
44265426,4.04E+17,2021/7/11,Danielle,Very close to everything!
33558235,447385927,2019/5/3,Peter,Great value
7563949,202259946,2017/10/10,Andrew,This place has incredible value and it was easy to feel at home.  I give Crystal a lot of credit for maintaining and upgrading her home so well.
9005989,8.71E+17,2023/4/16,Fr├®d├®ric,Great and confortable appartment. Really well located. I will visit again !
17238066,6.56E+17,2022/6/24,Jose,Great host and best place to stay
11639446,4.27E+17,2021/8/12,Susannah,"Keep in mind that this place is 40$, which compared to most places, is basically free. Adam is very good at communicating and quite accommodating. He met me outside, and can serve you your breakfast at any time you choose. Coffee was good!! DonŌĆÖt have high expectations, and you will not be disappointed. The room was clean enough, though the sheets were not. Bathroom and shared spaces basically unusable. Still, Bring your own sheets, and this place is definitely worth a stay for those on a budget."
52837196,8.57E+17,2023/3/27,Bryson,very responsive and helpful when needed. place was very clean.
9005989,213716129,2017/11/22,Isaak,This residence is possibly excellent for any couple or single person that could look for a place to stay either for only a night or a whole week. It is located in downtown/surburban Albany where you're not far from a park for a quiet day or a bar/night location for a more lively activity. Overall it is a residential where it is quiet.
48599533,8.86E+17,2023/5/7,Sonya,"Absolutely wonderful location and such a cute little apartment!! Hosts were amazing and incredible responsive. Our rental was on the 6th floor, and sometimes the elevator wasnŌĆÖt working, but honestly, I didnŌĆÖt mind the stairs! :)<br/>Would definitely book this apartment again!"
9005989,101661098,2016/9/14,Michael,"The studio is large, spacious, and fully equipped with a beautiful kitchen. Everything is redone very well. Even the bathroom is spectacular. The neighborhood is quaint and walking distance to most major sites in the city. I would, without a doubt, stay here again."
33558235,613659116,2020/3/2,Marcellin,"Nice place with a nice host!<br/>Attentive and available, Earl does everything he can to make sure we have a good time."
20633175,339610319,2018/10/21,Kelly,"Nicely decorated, extremely clean, and nice location on a quiet street with plenty of parking!"
39873571,8.76E+17,2023/4/23,Emily,"Clean apartment, friendly host."
28722270,416446467,2019/2/24,Emily,"Earl was extremely communicative and a wonderful host. This little flat is adorable and so charming, we couldnŌĆÖt believe it was such an affordable price! Very secure and safe, close to everything, and such a perfect Airbnb find for our stay. We will definitely be staying at EarlŌĆÖs place again next time we are in the area!"
38321579,4.83E+17,2021/10/28,Julio,A+
50211226,8.49E+17,2023/3/16,Rasheen,Best airbnb stay ever !!!
50171851,6.68E+17,2022/7/10,Shifra,The apartment is fantastic! ItŌĆÖs clean and modern and has everything in it you may need! Highly recommended!
26808765,517608430,2019/8/25,Judy,Such a lovely home in a picturesque setting. The park and surrounding area is amazing. Absolutely perfect!
38321579,6.22E+17,2022/5/7,Tameil,Always a pleasant stay!
29605579,735345252,2021/2/28,Edward,It was a clean comfortable apartment in a great location.
6.17E+17,8.90E+17,2023/5/12,Victoria,"BrianŌĆÖs place was perfect! Spacious, lovely, and walkable to many restaurants, bars, washinton park, & even a CVS. The bed was also very comfortable. Brian was communicative & checked in twice a day. The photos donŌĆÖt do the place Justice. Would definitely recommend & would definitely stay again."
52241973,7.27E+17,2022/9/29,Maarit,Jason deserves his super host title. It is very clean. Jason is prompt at responding to inquires.I would stay again.
7.00E+17,7.34E+17,2022/10/9,Meghan,"Brigid was a great host, she checked in on us and check-in was super easy. The apartment itself is a little misleading based on the pictures so if you stay here, just arrive with little to no expectations."
13711253,514638221,2019/8/21,Jonathan,"This is a very good place, and you can expect a good breakfast in the morning. Adam is very friendly!"
9501054,6.38E+17,2022/5/30,Sylvia,"Spacious room in a great location. We were able to park right in front of the building and pretty much everything downtown is within in walking distance.<br/>Easy check-in, very comfortable bed and a good shower. There's also a fridge, microwave and some plates and cutlery in case you want to warm up food. Communication with Gregg was quick and easy."
15580397,4.91E+17,2021/11/7,Brad,"nice home that was quiet, clean, and close to the hospital, I was able to walk there. the home was easy to find and great communication from the owner.  I would stay again in the future."
17514620,7.04E+17,2022/8/28,Ebubekir,"Easy to find, close to Albany Med and great place.<br/>Chad is a great host. He is responsible and easy to communicate. Definitely more than 5 stars!"
54128829,7.03E+17,2022/8/27,Jessica,"We were so lucky to come across Richard and PriscelaŌĆÖs home on Airbnb. The house was perfect for two families and had a lovely patio/backyard area to enjoy the weather. The house had everything you needed and more! You can tell they put a lot of thought into the items that they stocked the house with, making the stay for guests as enjoyable and effortless as possible. Check-in was a breeze! The beds were extremely comfortable and the house was spotless. We would go back in a heartbeat!"
32279028,444862479,2019/4/28,Joe,No
17238066,672108965,2020/10/7,Meerim,"Adam was great-very easy to communicate with, available 24/7. He also was kind enough to drive me to a nearby town. Thank you"
6.83E+17,7.08E+17,2022/9/3,Deborah,"This apartment is a great find -- good value and very clean. I needed a place to house visiting guests and Diana's place wolrked out just great for them/me.  The location is great for the group of restaurants, etc along Madison Avenue, or for getting to Lark St or Washington Park."
7.08E+17,7.61E+17,2022/11/15,Hans,Thank yo
42092736,5.65E+17,2022/2/18,Alexandra,"John is a very kind and accommodating host. The house was clean, the room was comfortable, and Patches the cat is the cutest roommate. I would stay again and recommend to a friend."
9005989,178032001,2017/8/4,Steve,Super convenient location<br/>Suited our needs perfectly<br/>Great lively neighborhood<br/>Next time in Albany we will stay here
45804322,713747475,2020/12/6,Kayla,Beautiful and comfortable place
39873571,7.89E+17,2022/12/24,Igor,Great Airbnb. Very clean. Not expensive. Everything you need. Excellent host
47334913,731616515,2021/2/15,Daige,"The place was great, we enjoyed our time in Albany as well as our comfortable and clean stay!!"
10768745,117070491,2016/12/4,Jon,I very much enjoyed my stay with Liz in Albany. The room was well appointed and very comfortable. The location is in a nice neighborhood close to local restaurants and bars with easy access to downtown and major thoroughfares. Liz is always quick to respond to a message and made sure that all was well with the stay. I would highly recommend checking out her place when visiting Albany!
3820211,62281520,2016/2/13,Damon,We met Terra and had a great conversation. It was our second time staying there. We love to stay at the apartment every time we come to Albany to see a show. The egg is very close. We got to see an great show. The pizza place across the street is great. It is open late too. The apartment is always nice to have some pizza and a good nights sleep.
6.78E+17,8.62E+17,2023/4/3,Jasmine,Johnny was such an amazing host and very responsive. He answered all my questions and made me feel very comfortable during the booking process. The inside of the house was beautiful and gave an at home kind of feel. Everything I needed was literally minutes away. This is definitely a place IŌĆÖll be staying at again!
5.95E+17,6.17E+17,2022/5/1,Elki,This place was fanatics and beautiful with thoughtful and practical touches of a super host. Super spacious. Very relaxing and inviting place that made me feel right at home. Would highly recommend this place over a hotel any day when popping into Albany. Directions to find were precise and Diana was super responsive and accommodating. Next time I visit my sister I know where IŌĆÖm staying!
3820211,8.51E+17,2023/3/19,Santi / Bogdan,"This was a good place, we had some missing amenities which the host resolved on the next day. Highly recommended for the central location and clean space."
25549565,4.33E+17,2021/8/20,Kama,Comfortable and clean place in a good location. We arrived late and left early with no issues
6.90E+17,8.75E+17,2023/4/22,Sara,Space was super cute and we could walk to everything we needed. Parking was easy also.
47408047,6.84E+17,2022/8/1,Michael,Nice comfortable perfect stay for 2 he also worked with us with our service dog 10/10 would stay again
10768745,4.33E+17,2021/8/20,Claire,"Quite a unique airbnb. Spacious studio, unusually furnished, comfy bed, lovely host and thoughtful touches. Be sure you get the correct set of keys as there are two studios. The garden  and swimming pool are an added bonus. The location is convenient, just Off New Scotland  near hospitals and colleges. Off a quiet park. I certainly will stay here again."
7.38E+17,8.75E+17,2023/4/22,Marisa,Great stay! Thank you Diana for hosting us.
19527043,425932959,2019/3/19,Peter,A great little overnight stop. Ed is a great host and was not only super helpful but very kind too. Highly recommended.
28400263,710097539,2020/11/20,Youssef,"Ed's place is fantastic. It's clean, near lots of green space, and close enough to downtown Albany and nearby dining corridors. Ed and Ann are just wonderful people and hosts. They made me feel like I was welcome to use and live in the space like it was a normal apartment or house I owned. Their kindness, generosity, and personableness has made my stay in the cold fall/winter of Albany much more positive and enjoyable. Highly recommend."
53567589,6.14E+17,2022/4/27,Wendy L,"Brian, thank you for being so attentive! The location is perfect, within walking distance to the Capitol and comfy and cozy as ever. Everything was so neat and clean and access was so easy.<br/><br/>Thank you, I hope next time I go up its available.<br/><br/>Best,<br/>Wendy"
10768745,8.91E+17,2023/5/13,Amanda,"I have stayed here twice now, it's a great spot. This little studio apartment is in an old Victorian and has lots of charm. It is helpful to have a mini-fridge, microwave, and kettle available for use. The room is not particularly sound-proof so folks sensitive to noise may be occasionally disturbed by noise from the adjacent apartments."
6.37E+17,7.84E+17,2022/12/17,Lijah,Good host
6.17E+17,9.01E+17,2023/5/28,Jacob,Brian was a great host and very responsive/helpful. The apartment was wonderful.
16531782,638754524,2020/7/16,Daniele,Awesome place very peaceful
6.69E+17,6.78E+17,2022/7/23,Pamela,"This is a lovely, extremely well-maintained, historic home. Very clean, very spacious and comfortable, great location, good communication, and just an overall wonderful stay."
6.34E+17,8.25E+17,2023/2/12,Abbie,"Great place, great host"
10768745,448023876,2019/5/4,Christine,"The place is amazing ,,, big windows, old wood, great bathroom,,, very Victorian,,,,and comfy bed despite the fact that its a pull out ,,, <br/>Great place to stay especially for the price"
28722270,404572748,2019/1/24,Bruno,"Eu realmente me sinto em casa quando estou aqui, o espa├¦o ├® muito aconchegante e confort├Īvel.<br/>O Earl ├® muito atencioso e sempre responde muito r├Īpido qualquer solicita├¦├Żo, eu recomendo mil vezes este lugar maravilhoso !"
22431640,266801469,2018/5/20,Kristen,Very conveniently located and well kept space with nice amenities and a pleasant atmosphere. Would 10/10 recommend for a stay in Albany. Jake answers questions promptly and is very amicable. Great value.
13711253,353335972,2018/11/27,Eric,"With warm hospitality and prompt communications, you will be a welcomed traveler to this international place."
52359404,8.96E+17,2023/5/21,Alison,We were very comfortable at IrisŌĆÖs place.  Perfect for our familyŌĆÖs home base to explore Albany and Troy.  Iris was super responsive and gave us some great local restaurant recommendations!
44180048,8.98E+17,2023/5/23,Dave,The room was excellently clean. Very comfortable. Wonderful old world charm. Excellent location right across from Washington Park. Would highly recommend. Will visit again. Next time we are in Albany.
47440071,7.29E+17,2022/10/2,Nina,"The loft space is fantastic and very comfortable, it is very spacious and has a very homely feel to it! Would definitely recommend staying here! Thomas was very, kind, and always reachable for any and all questions."
25549565,6.28E+17,2022/5/16,Frank,Great location
33558235,7.36E+17,2022/10/11,Renthanglo,Earl was very responsive. We had a wonderful time.Will love to come back again
1489424,572687463,2019/12/3,Steven,The host canceled this reservation 2 days before arrival. This is an automated posting.
24120690,431061493,2019/3/31,Audrey,"DominiŌĆÖs place was very convenient for me, as I was in Albany for the weekend to attend a class at St. Rose. She provided snacks and beverage, and access to a keurig, which were great touches. There was a private entrance, bathroom and room, which was great. I had some minor difficulties getting into the place (I didnŌĆÖt realize the were an actual physical key in the box. Lol) and she came to help me right away when I called. She was very pleasant and helpful. Overall, I would definitely stay at DominiŌĆÖs again."
20671966,197141545,2017/9/24,Melanie,"Beautiful house, the apartment was a little hot but there were air conditioners so it wasn't too bad. It's a huge house and there was plenty of room, definitely would visit again!"
9501054,315400697,2018/8/28,Alex,Great value and super convenient for where I needed to go. This was my first Airbnb so I'm pleased!
13711253,224617093,2018/1/3,Adam,"Adam truly had something special with his Airbnb setup.  His hospitality, alone is worth the stay but add in the meals and service and it's something truly unique.    The location is great your right at the heart of it all.  I don't believe there is a better place to stay, not just in Albany but period."
10768745,174983126,2017/7/27,William,"Great location, huge room, and best price. "
52837196,5.11E+17,2021/12/5,L,"This space was perfect! Great location, modern, chic, CLEAN and cozy! We will return."
45804322,4.40E+17,2021/8/29,Tiia,"This is a great value. It is everything it promises, roomy, quiet, clean, peaceful. I would stay here for a day or a month. Loved the beautiful bathroom, ceiling fans and comfy bed. Will always try to stay here when in the Capital region."
52863776,5.05E+17,2021/11/27,Stefan,We had a wonder time here and loved the location. 10/10 would stay again. It was especially nice to be here during the Capital city lights which are in the park across the street.  Lloyds communication is unmatched as he suggested things to do and places to eat. I highly recommend SavoyŌĆÖs  for food and a pleasant staff. Lionheart is a fun dart bar as well. <br/>We will definitely stay again as it was charming and everything that you want in a park side Airbnb.
22431640,658496600,2020/8/30,Nathan,We had a wonderful time and were very comfortable
39864828,7.59E+17,2022/11/13,Katelyn,"The shower curtain rod easily falls down.  It fell down 2 X at the end of showering.<br/>We only had 4 guests over during our stay as you requested.  Also, there was food and drink left in the fridge; from previous guests.  Though, the beds were comfy and it was a nice place to stay."
32993402,468890355,2019/6/13,Jean,"This apartment is very well appointed with two bedrooms and extras in the refrigerator. The neighborhood is not fancy, though, and IŌĆÖd be sure to lock your car."
42092736,4.91E+17,2021/11/7,Ron,"John is a top notch AirBnB host. Great communication. Comfortable bed. Great location. His dog, a Golden Doodle, and cat, were very friendly and entertaining. If I had to stay in Albany again, John's place would be at the top of my list."
33558235,4.56E+17,2021/9/21,Leah,"Great value, great location, equipped and comfortable!"
51964868,5.47E+17,2022/1/24,Shakyra,"Location was good, close to everything and shops. Uber friendly. Bathroom did get a bit code but the hot water was on point! Host were accomodating and responsive. Would stay again! Priced well for area."
52836323,8.89E+17,2023/5/11,Marcia,"This was a wonderful surprise!  Super cute, great location. <br/>IŌĆÖll definitely book again while visiting family!"
52611613,8.81E+17,2023/4/30,Molly,"DianaŌĆÖs place was perfect for a girlsŌĆ?weekend away! Central location, clean, comfortableŌĆöeverything we needed for a lovely trip."
6.37E+17,7.28E+17,2022/9/30,Enoch,good
35914565,716269436,2020/12/18,Katie,This place was wonderful! Diana was very responsive and helpful. The place itself was very cozy and had everything we needed and more. It snowed while we were there and we had great help digging our car out.
45529447,5.16E+17,2021/12/12,Dominique,Thank you for having me the bnb was clean & exactly described as listing .
5651579,8.59E+17,2023/3/31,Quinn,"Big space, peaceful street, easy highway access, friendly and responsive host"
39864828,6.57E+17,2022/6/25,Brody,A cool loft with a great location for a visit to Albany. Very close to the highway as well as some good places to go to nearby.
5651579,426265369,2019/3/20,Talitha,The location was excellent for site-seeing and was really cute!
54128829,5.95E+17,2022/3/31,Jerrod,Best Airbnb in Albany! Responsive hosts and a fantastic home.
2992450,21810844,2014/10/24,Christopher,"This may be a little late, but just to say Kenneth was quick to respond to our request. He left some supplies in the refrigerator and kindly showed us round downtown Albany. We were without a car and he arranged for his cousin Kristina to take us to  supermarket.<br/>The apartment is large, clean with many original features. It is situated in an historical area that is fairly central, although like the rest of Albany you have to climb a steep hill to get to it if you are on foot. <br/>"
52691284,7.54E+17,2022/11/6,Sarah,This place was great for our group and Diana is very easy to communicate with
30189794,6.72E+17,2022/7/15,Richard,"Good room with its own bath, fridge, and window AC unit. The unit is a little noisy. Has a full kitchen for use. Good for longer term travelers"
6.23E+17,6.74E+17,2022/7/18,Rogue,"This is was in a perfect location because there was so much stuff to do near by everything was at most like a 10 minute walk. The apartment was amazing, so cute and i loved the layout of the apartment and the kitchen."
46894493,5.72E+17,2022/2/27,Miguel,"Everything was as beautiful as the photos! The hosts gave us nice recommendations for the area and had nice things supplied like coffee, fresh towels, soaps, and even chocolates. A nice and quiet location too!"
52837196,4.89E+17,2021/11/5,Valarie,LindaŌĆÖs place was fantastic! Cute and close to everything we needed!
8035768,53445289,2015/11/8,Leigha,"John's place was extremely cozy and had more than everything we needed. We just stopped for a quick one-night stay. He was very accommodating, and the house is beautiful! We would definitely stay here again next time we're in Albany. "
6623339,402178465,2019/1/17,Cheyenne,Was a great stay! Perfect location for downtown Albany and the Empire State Plaza!
47334913,732607573,2021/2/19,Sherema,Just awesome
32993402,616990671,2020/3/11,Karen,Earl's place is clean and comfortable. Would recommend.
39836487,578071503,2019/12/16,Anika,"Adem's place has been awesome and super clean. My husband and I   really enjoy our stay, however, it was too noisy for us. Nevertheless, the Adem was very helpful and responsive."
5.65E+17,6.33E+17,2022/5/22,Charles,DianaŌĆÖs place was wonderful. ThereŌĆÖs plenty of great food nearby and she was very accommodating as a host!
38321579,6.72E+17,2022/7/16,Nicole,Diana's residence was nice and clean and located in a very quiet peaceful neighborhood. Diana was very welcoming polite and helpful. It was an overall great experience I have further appts in the area and definitely planning to return.
6623339,39239882,2015/7/21,Jennifer,"Terra was a great host - quick to respond and made my first AirBnB stay a breeze. This place is even better in person - clean, airy and close to everything. Even though I had a car, I didn't need to use it. I will be staying here when I am in Albany. Thanks for a great experience, Terra. "
10768745,8.10E+17,2023/1/21,Jorich,"Great stay, quiet place and neighborhood, clean and cosy bed. Liz is friendly and easy to communicate. Will book again in the future"
10768745,754097851,2021/5/2,Annie,Liz was an outstanding host.  The house and property were out of the 1800s mixed with the quirkiness of an artist.  Birds and nature surround the home with an outdoor bohemian-like retreat.  The room itself had the comfort of home with the majestic design of the Victorian-era.  I loved this experience.
8915877,5.62E+17,2022/2/13,Cecely,I had a good stay here and would recommend this location as a traveler nurse both hospitals are close by. Definitely a nice cozy apartment.
21449583,223674602,2018/1/1,Matt,"We really enjoyed our stay at PiotrŌĆÖs place! He was super communicative, and the house was clean, tidy and had ample space. Overall, everything was easy and comfortable."
5651579,108109490,2016/10/14,Brendan,Gregg's place is a great spot to explore Albany and the surrounding region from.  Very safe and comfortable and a stone's throw from the Empire Plaza/State Capital and a short walk to Lark Street and other bars/caf├®s/restaurants.  Ample street parking as well.  Would recommend to anyone needing a convenient place on a budget in the Capital Region<br/><br/>Restaurant recommendations in Albany: Bombers Burritos and Sukhothai.
50890336,4.86E+17,2021/11/1,Juan,"Was a great stay. House was clean and tidy. Great location. Linda was quick to respond to any questions, such a wonderful host."
42490432,7.23E+17,2022/9/24,Jason,"Had a great stay at DianaŌĆÖs Airbnb. She was very communicative from the start of the reservation. Parking, check in, and house rules were pretty clear. I would definitely stay here again!"
28868857,7.40E+17,2022/10/17,Ashley,"Although, I was unable to stay in the end, Earl was extremely easy to communicate with and was very quick to respond with any questions I had leading up to the trip. The was no confusion or hesitation regarding the stay, it just didnŌĆÖt work out in the end."
