Listing_id,Review_id,Date,Reviewer_name,Comments
54105517,6.81E+17,2022/7/28,Deep,"I loved this unit. I was in Albany for the bar exam and this unit was less than 10 minutes walk away and extremely convenient. The hostess, Marlene was amazing, kind and extremely helpful. The unit was large, clean and modern. I loved the fact that the owners have an Italian restaurant (Cafe Capriccio) next door. I ate there every night during my stay!!! Highly recommend this unit!"
32279028,516601660,2019/8/24,Sudhir,N
47334913,8.72E+17,2023/4/17,Courtney,"Allen was responsive, friendly and super accommodating. The bed and couch were super comfortable. The unit was Perfect for the weekend I needed to be in the area for school. Unit was super clean, organized but made you fee at home."
38321579,5.44E+17,2022/1/20,Sue,IŌĆÖm a repeat guest - DianaŌĆÖs place is great and I visit often!
20620135,510166009,2019/8/15,Anne,"We were so delighted with this little red house--it's cuter than the pictures show, and it had everything we needed.  I definitely recommend staying here. Location is INCREDIBLE and internet is fast. Home is super comfy. If it's available, snap it up!"
22431640,646368107,2020/8/3,Whitney,Jakes place was super clean and there were a lot of thoughtful touches. My boyfriend and I will most definitely be staying here again on our next visit to Albany!
48124042,6.82E+17,2022/7/29,Denisse,"El alojamiento muy bien ubicado y muy lindo. Lo unico en contra es que no tiene ventilaci├│n. De todas maneras, super recomendable! <br/><br/>Really good apartment. Great location near to the bus. The only ŌĆ£bad thingŌĆ?its that the apartment doesnŌĆÖt have ventilation."
5651579,356213916,2018/12/7,Oriol,"Top location. Nice room. Shared, clean bathroom."
28722270,3.87E+17,2021/6/17,Mike,"I had a great time in Earls loft. He was very quick to respond about my questions prior to my arrival regarding work, and internet speeds. The loft is extremely cozy, and I felt at home immediately upon arriving. I was able to cook comfortably, and working in this cozy loft was a really nice change of pace for me. My only request would be that they fix the leaky ceiling in the bedroom. My first night there it rained and water dripped right on the nightstand and got in my cell phone and nearly ruined an old 35mm film camera I had sitting there. Other than this incident, I would HIGHLY recommend this stay to anyone looking to enjoy the cozy space and proximity to everything in Albany!"
34330970,6.86E+17,2022/8/4,Paul,Fun!
44180048,741014430,2021/3/21,Nkasiobi,"Beautiful studio right across the street from Washington park. Check in was extremely easy, fast replies from host & I felt safe. 10/10 I highly recommend staying here."
28868857,5.67E+17,2022/2/20,Tori,Good for the value
39864828,597421260,2020/1/25,Kara,"Matthews loft was the best Airbnb experiences as of yet. <br/>Everything was just as he described , if not better!<br/> Right down to the complimentary gumballs and swedish fish. <br/>The small private outdoor area was a huge plus traveling with our dogs . <br/>And let's not <br/>forget the inside cornhole ... so much fun! <br/>We wish we could have stayed longer.<br/> Loved this place and will be back for sure!"
42092736,609830838,2020/2/23,Marygrace,"John is an awesome host. Sweet, kind and thoughtful.   The kitty was adorable and loving and the fish tanks gave a tranquil vibe. Loved him and will stay again. He is A+++."
11639446,333696167,2018/10/7,Gregg,"Adam is a great host, made me feel at home during my stay and I enjoyed the unique extras like the organic breakfasts.<br/>I enjoyed talking with Adam, he went out of his way to help me with my luggage, parking and local attractions that I would be interested in.<br/>One of the best deals on air bnb I've experienced.<br/>~Namaste~"
13711253,144404534,2017/4/15,Brenda And Mark,"Very attentive host with his guest's well being on his mind. We had a great dinner with Adam, he has a very interesting background and nutrition knowledge. we enjoyed our stay. Thank you again Adam!"
53567589,6.63E+17,2022/7/3,Sarah,"This apartment was very nice, and Brian was extremely responsive and helpful! I donŌĆÖt think we would stay in this neighborhood again, but that is just a personal preference - the Airbnb was perfect. I also appreciated that no cleaning, laundry, etc. was required for check-out - we just turned out the lights and headed out, which was very convenient for our multi-day drive."
52241973,6.55E+17,2022/6/22,Michael,"Jason's place is fantastic! And he is a gentleman host! <br/>I was in town one day for work and this quaint beautifully furnished space was as clean as it was cozy.<br/>Really neat set up,  hot shower, cool kitchen,  and though I was only one there is plenty of space for two!<br/>I'll be back next time I have to stay over for sure!"
39836487,4.37E+17,2021/8/25,Bibi,"Adem was such a gracious, respectful host, the place was very clean and cool. I was provided with everything I needed coffee to toiletries. There was a washer,  and just an over all comfy space. Will be back"
44180048,6.49E+17,2022/6/13,Douglas,Very nice place and great location.
3820211,49792440,2015/10/6,Laurie,"Terra made the apt available to me much sooner than expected. The apt itself had everything I could want or need.  With my loved ones so close, this airbnb is a godsend. I would definitely rent again.<br/>"
51579900,4.81E+17,2021/10/25,Ryan,ItŌĆÖs a great apartment for a couple. Linda is great and very quick with responses. Just be aware if you have the windows open over night you will hear trains coming by but if the windows are closed itŌĆÖs barely noticeable. The apartment is clean and very spacious with everything you could need for a short or long stay. It is located directly on the outskirts of Albany and a few minutes drive from the capital building and other activities.
3820211,215252020,2017/11/28,Ashley,"Terra's place is awesome. Off street parking was wonderful. Close to downtown Albany, many restaurants and things to do nearby, comfortable and clean. I highly recommend it."
28722270,541622746,2019/10/5,Lindsey,"Earl was always available to respond to my questions, and did so quickly! His place is quite spacious and there was street parking right out front, even on a Friday night! It was very clean and I enjoyed the comfy couch and access to Netflix. I took a yoga class at Lark Street Yoga and would highly recommend that - itŌĆÖs a short drive from the apartment! Thanks Earl!"
17238066,4.76E+17,2021/10/18,Bob,"Adam is a great host. He was comfortable in conversation, but he waited until I initiated it. Breakfast was delicious! Room was small but clean and comfortable. It was exactly what he described. Not a 5 star hotel, but that wasn't what I paid for. :-)"
54126427,7.80E+17,2022/12/11,Amy,Great stay!
45024912,5.01E+17,2021/11/21,Kayla,ElsaŌĆÖs home felt like home! It was a wonderful space! The home came with many cleaning supplies! We were able to cook breakfast every morning during our stay because she had everything we needed! We are already planning our next stay! This place was wonderful! Thank you again!
3820211,422995035,2019/3/12,Hanna,"A neat, safe apartment in central Albany. Would happily stay again"
53567589,8.60E+17,2023/4/1,Kate,"I cannot recommend staying here enough ŌĆ?everything about our experience was five-star worthy! The place itself is very beautifully decorated, with lots of amenities and super close walking distance to much of what Albany has to offer. Whenever I needed something or had a question, Brian was very quick to respond, and was helpful and friendly. All in all, would stay here again 100%!"
6.23E+17,7.46E+17,2022/10/25,John,Everything was just as described and perfectly suited my needs.
9005989,109123208,2016/10/19,Bill,"She made us feel so welcome.  We made her life so hard.  We set off the smoke alarm cooking dinner and we felt so bad.  We did enjoy everything about the place.  I am so glad she was so accommodating, I hope we did not take too much advantage. The place was in a great part of town and they were really amazing."
24655782,5.61E+17,2022/2/12,Molly,It was amazing. Very easy to find and very spacious. Everything was incredibly cozy and immaculately clean. Close to everything as well!
35914565,7.25E+17,2022/9/27,Paul,"It was loud at night, the cleaning was okay. But everything else was immaculate. It would be nice if you refunded customers partially if they left the area clean and fresh just like it was before the came in. Because I cleaned everything and all but beautiful place. ­¤śā"
5651579,439778350,2019/4/19,Kristina,"The location is good, just a few minutes walk to the New York State Museum. The room is right under a living room(?) upstairs, and most of the evening I heard the family above me walking and moving about upstairs. One night's stay was enough me."
26808765,593661765,2020/1/16,Anthony,Great step away from the normal
25549565,8.49E+17,2023/3/16,Amy,"Very quiet,  clean place to stay. Highly recommend!"
9501054,61986430,2016/2/10,Haavard,"This place had what I needed. A bed, shower, wifi, it was close to the Times Union Center and it was a bar one minute down the street. <br/>The room was basic (but big) and not cozy."
6.43E+17,7.30E+17,2022/10/3,Adam,Perfect location to anything in Albany. Very clean. Amazing communication. Perfect for a weekend away.
10768745,339496277,2018/10/21,Brandon,Nice place ! Easy bus ride to downtown.
50171851,4.55E+17,2021/9/19,Jolana,"Todd's place was just as advertised, spotless, and very tastefully decorated. The check-in instructions were very easy to follow and Todd was super quick to respond with any questions during my whole stay. The location was perfect, and close to everything. <br/><br/>It is on-street parking, but even on busy nights I was able to find a spot within a block of the apartment. <br/><br/>The apartment had everything I needed for my stay, and more. I would 100% stay again if I am in the area. I only wish I had more time to enjoy the apartment, the courtyard, and it's surroundings (was here on a work trip), but hopefully there is a next time!"
12284708,187248112,2017/8/26,Jael,Nicholas' place is a good base both if you are heading out of the city by car or explore downtown Albany by foot. We were very comfortable there.
11253948,80860249,2016/6/20,Michael,A truly excellent experience with a host who was responsive and caring. Excellent and fast communication and he put forth effort to go beyond what was expected or required. The house is newly renovated and it feels like everything is brand new and well thought out. 
45529447,7.35E+17,2022/10/11,Roberto,Don't fall for the pretty pictures. Furniture is extremely cheap and flimsy and beds are un-sleepably hard. Pillows are also the worst I've laid my head on. All I wanted was a good night's rest and I was tossing and turning all night. I tried communicating with the host and she in turn got offended that I was honest with my feedback.
25549565,7.88E+17,2022/12/23,Elie,"Malgr├® le froid dans l'appartement, le logement ├®tait propre et bien agenc├®. nous avons appr├®ci├® la nuit pass├®e chez Janet. <br/><br/>Merci, je recommande!"
13083497,6.18E+17,2022/5/2,Colleen,"Overall the place was clean, spacious and quiet.  There were plenty of bed for our guests."
48407173,8.61E+17,2023/4/2,Christopher,"Loved it. Quaint and cozy place with restaurants, bars and a grocery store all within walking distance.  Just pay attention to the posted parking signs"
28722270,715727194,2020/12/15,Chris,"Nice, clean space. Good for an overnight stay. Very responsive and easy contactless experience."
51230498,4.66E+17,2021/10/4,Alissa,Perfect spot for my one night stay for a wedding event. Car was safely parked on the street overnight with no issues.
9501054,8.56E+17,2023/3/26,Michael,"Nice space, mostly convenient parking near by.<br/>Walking distance to the MVP Arena and a few restaurants and pubs.<br/>Really close to highway"
42490432,708324496,2020/11/12,Carrie,Very cool apt. Diana very quick to respond to questions.
10768745,534241996,2019/9/22,Claudia,"Super clean, easy to access, safe location. Highly recommend."
28868857,461481937,2019/5/31,Alexander,Great place for a quick stay. Place had everything my wife and I needed and Earl was extremely quick to respond to any questions we had.
29605579,7.34E+17,2022/10/9,Kayla,"Nice apartment, great location near Washington park and the museum."
21769439,313556461,2018/8/25,Maruf,Great Host!
6.54E+17,8.61E+17,2023/4/2,Dylan,Loved the place! Definitely worth what i paid and she is very friendly. Definitely worth staying at.
7.36E+17,8.52E+17,2023/3/20,Jack,"This is the perfect place to stay if you are attending a four-day event around the MVP Arena. We did for March Madness 2023. Everything is walking distance to restaurants, the legislature, the arena and museum."
24655782,4.85E+17,2021/10/30,Jack,Awesome place super clean and quite big as well.
44180048,7.62E+17,2022/11/17,Gregory,A very cool place in a great location and very comfortable
54126420,7.68E+17,2022/11/25,Virginia,"A great old fashioned apartment, railroad flat style, with modern decor.  ItŌĆÖs only a few blocks from the 114 bus if you want to go downtown without driving.  Wonderful neighborhood to walk in easily to restaurants.  Quiet neighborhood. <br/>The first night it sounded like a mother and child were operating a train set upstairs.  Imagination I realize but that and some door slamming was my only complaint. Second night I closed the bedroom door and slept better. <br/>The bed is firm but extremely comfortable.  The kitchen is fine with a nice big frig.  The blinds are easy to raise and lower. Anything you need to know Erion will tell you.   <br/>YouŌĆÖll enjoy your stay here."
32279028,8.91E+17,2023/5/14,Chitra,"Diana was a great and helpful host (went above and beyond). Very nice house and neighborhood. Clean room, bathroom, place close to bus stop and downtown."
6.57E+17,7.64E+17,2022/11/19,Alberto,"The unit was very cozy, clean and at an accessible location. Shawn was very supportive and it was a pleasure to have him as a host."
21392315,7.10E+17,2022/9/6,Noah,"Bela and Laurie were very accommodating hosts. The unit is clean, well-furnished, and centrally located."
50639032,4.94E+17,2021/11/12,Kellen,Very nice and accommodating!
42490432,4.41E+17,2021/8/30,Agatha,"Such a great host! Check-in was super smooth, and any questions we had were answered very fast! We immediately smelled how clean and sanitized the place was, which made us feel great as we could tell precautions were taken and the right cleaning process was done! The place is very modern, and my partner and I found the layout to be very interesting and just enough room for the two of us. The parking spot is a great bonus, and the location was overall great for us. We had a great time, and would definitely recommend booking with this host!."
9501054,142494839,2017/4/8,Patricia,"Very nice place with everything that is important a clean comfortable bed, clean and hot shower and large quiet room. Located in a nice brownstone the room is on the street level. <br/>I was able to park on the street in front of the building but the spaces are limited. Gregg offer a garage around the block but I did not use it.<br/>Gregg was quick to answer any questions and the entire stay was pleasant."
47408047,7.39E+17,2022/10/16,Rosa,our was extremely comfortable. The location good for getting around town. Getting in and out was easy. Extras on bath and kitchen were a bonus.
9005989,208901732,2017/11/3,Mike,"This is a fabulous apartment--extremely clean, new appliances, and nice furniture. It's also in a great location, a block away from restaurants and bars on Lark Street. I highly recommend it for a short or long stay!"
6.48E+17,6.80E+17,2022/7/27,Francisco,Host was very accommodating and was very responsive. Location is in a quiet residential street. Would stay again if IŌĆÖm the area.
7.47E+17,7.75E+17,2022/12/5,Michaela,nothing
1489424,26769484,2015/2/18,Ross,"House is warm and cozy.  Pictures are accurate.  Very warm reception, especially considering it was only 7 degrees out that night.  Very quite and easy for me to focus on work.  I recommend the place."
32993402,6.81E+17,2022/7/28,Ella,"Very conveniently located, great communication!"
48052353,5.12E+17,2021/12/6,Arielle,Scotts place was great only issue was finding parking on the street other then that this is the nicest airbnb I have stayed at 10/10 recommended will stay again
44265426,4.32E+17,2021/8/18,Todd,"This may be the best value we've had on AirBnB.  It's really a lovely place. Clean, charming, great location, friendly people.  We will definitely stay here again if it's available."
11253948,93154951,2016/8/11,Brad,"The Art Bungalow is exactly as it looks in photos- clean, simple, and being renovated. Piotr has done a lot of work on the house, from the floors to the new kitchen to new stairs.<br/>He was very communicative and easy to work with. Thanks for the stay!"
51710034,5.62E+17,2022/2/13,Matthew,Amazing location and beautiful apartment. The host was a great communicator and set us up for an awesome weekend. Would definitely stay here again.
45024912,725651913,2021/1/20,Audrey,"My family and I were so pleased with the accommodations. It was a bit of a stressful time as I was in town for an exam, and it was the perfect cozy, quiet, clean, and well-stocked refuge that we needed! Quite nicely decorated too. And they were super responsive and accommodating with all our questions and needs. Highly recommended!"
43208391,703005689,2020/10/23,Mary,The house was very clean and comfortable. The location was great for our family to pivot from for historical sites and visiting other states.
38321579,4.88E+17,2021/11/3,Piotr,Great stay as always!
48052353,5.66E+17,2022/2/19,Sean,Clean and quiet. An easy drive or Uber to downtown
54369240,6.41E+17,2022/6/3,Chelsea,We loved our stay. Allen was super helpful and communicative! Apartment was just as described and super clean and spacious. Definitely will plan stay here again if In the area!
22431640,7.37E+17,2022/10/13,Richard,Great place - very central but quiet with everything you need and even coffee!
24655782,358007159,2018/12/12,Julia,Jakes place is great! Super clean and cute. ItŌĆÖs about a half mile from downtown Albany and a 15 minute drive from the airport. Jake is also super responsive to messages which is very helpful. Would definitely recommend!
53645427,6.38E+17,2022/5/30,Andrew,"Beautiful, spacious apartment and very close to lots of bars and restaurants."
34330970,740641595,2021/3/20,Kyle,DianaŌĆÖs place was outstanding!!!!! The Apt was way bigger in person! She recommended great places to visit and we found great local restaurants near by! Will stay again. Excellent!
5.65E+17,8.22E+17,2023/2/7,Joseph,"I have now stayed in 2 of her spaces, and I highly recommend both. They are very homey and she is very responsive and helpful. I am to return to the area soon, and I will be staying in one of her spaces for sure"
29605579,7.24E+17,2022/9/25,James,Nice 1BR/1BA apartment in great area.  Close to restaurants and capital.  I've stayed here at least 4 to 5 times and is my first pick when I come to Albany to visit my daughter.   You won't be disappointed.
10768745,594066939,2020/1/17,Jeffrey,A beautifully decorated and furnished period room with everything I could have asked for. Highly recommended.
18341426,4.80E+17,2021/10/23,Tyler,"First time in a sauna, really clean place to stay and very cool modern technology! Good area of Albany too!"
32993402,5.01E+17,2021/11/21,Ruth-Anne,"I would have given a 5 rating but I was unsure of the neighborhood and the noise from upstairs kept me awake.  I was alone except for one night and I am a country girl.  I am also a very light sleeper.  If you are used to the noise and have experience with city living, this would likely be a 5 for you.  Earl was very easy to communicate with and very nice."
51710034,8.91E+17,2023/5/14,Sincere,I like it everything was perfect
1489424,7.47E+17,2022/10/27,Andreas,Great place to stay in the Albany area! Will be staying here again.
54128829,6.73E+17,2022/7/17,Halima,"Richard & Priscela are wonderful hosts and we had a great time staying at their place. The place was fully equipped, bright and airy. We were able to find parking in front of the house. The home was clean and had central cooling. We had an issue with our iron so I contacted Richard, who within 10 min. dropped of a new one! I highly recommend staying here if you are ever in the area."
39864828,5.71E+17,2022/2/26,Jeffrey,Great location! Even on a cold night was just a short walk to the Palace Theatre & a great restaurant. This is a fun & sophisticated loft thatŌĆÖs meticulously clean and has all the right touches.
22431640,458109663,2019/5/25,Nani,"Great location for my needs. Enjoyed a pleasant, worry free stay to spend time with my family."
14316232,99779146,2016/9/5,Alicia,"House has antique charm and you won't find a better location for out of towners looking to explore the area (walk to Lark St, Washington Park, and downtown Albany). Nic and Liz are experienced hosts and it definitely shows through their communication! Some highlights: keypad front entry, more than adequate linens, towels, shampoo and conditioner, and smart TV in room with Netflix account. "
7.29E+17,7.81E+17,2022/12/13,Eduardo,"Loved my stay in downtown Albany, beautiful apartment with a great view. Lucy our host was great as well, very easy to reach and always there to answer any questions. 10/10"
12284708,99256567,2016/9/4,Marilyn,THE HOSTS ARE VERY FRIENDLY AND WELCOMING. THEY ARE GREAT PEOPLE TO CHAT WITH. THE ROOM IS VERY CLEAN AND COMFORTABLE. IT IS CLOSE TO WHERE I WORK WHICH MAKES IT A GREAT LOCATION. THIS IS WHY MY HUSBAND AND I ARE A REPEATED CUSTOMER OF THEIRS.
28868857,4.20E+17,2021/8/2,Sydney,"Great place! The location was a little rougher than we expected, but the place felt safe and was very comfortable. It was clean, and our host did an amazing job communicating with us."
9005989,7.32E+17,2022/10/6,Aliya,"SugeyŌĆÖs place was very nice with everything you would need. I was only there one night but after a late night out, the heater she had going, extra heavy blanket, and soft bed were wonderful! Definitely recommend."
3820211,36066543,2015/6/24,Marion,"We really enjoyed our stay at Terra's apartment, the place is great as well as the location.<br/>There was a little misunderstanding with the check-out time but Terra was very nice about it and made sure everything worked for everyone. <br/>I really recommend staying there!"
11253948,738098778,2021/3/11,Anne,"Peter is an excellent host and this home is beautifully appointed. I have stayed at two of his homes and been delighted each time. Completely recommend!  Close to college, hospital, shopping."
7.86E+17,8.98E+17,2023/5/23,Rose,"The space was extremely clean and comfortable. It looked exactly like the photos. Check in was simple since the instructions were clearly stated. I had few issues but all my questions were quickly answered. <br/><br/>There were occasional noises from a young child upstairs, but nothing I was really bothered by. I would definitely stay with Tomar and Kash again next time I'm in Albany"
28868857,418591597,2019/3/2,Suzanne,"The ""Cozy Garden Apartment"" at Earl's place was exactly what we were looking to find:  a place that--while spartan--was sparkling-clean, with all the basic necessities (quick food for breakfast, bottled water, full supply of bath, hand towels and wash cloth, soaps and shampoo AND a hair dryer).  We were so happy with Earl's meticulous details about checking in and  about finding the off-street parking.  Best of everything: THE LOCATION.  Anyone attending a game, a concert, a convention rally involving the Times Union Center should put Earl's apartment on their list.  What a delight to be a mere eight-minute walk directly to and from the Center.  Perfect location for good caf├®s, bistros,  and pubs within a five-minute drive.  This apartment made everything about our brief, overnight stay all the easier and more pleasant.  Great price.  We'll be back!"
6.69E+17,6.92E+17,2022/8/12,Isabelle,Purrrrrfect!
45529316,4.49E+17,2021/9/11,Jessica,"This airbnb was really nice and we enjoyed staying there. The host did an excellent job fixing problems. We also really appreciated the free coffee and how easy check in and check out were. I would stay here again. <br/><br/>I was a bit disappointed, as others have said, that there was no included parking as listed in the ad. Still, we were able to find parking down the street, within a block."
22431640,706183865,2020/11/2,Dave,"I had a hotel room originally but my room was double booked. I needed a solution fast. Jake was excellent at responding quickly and I was able to reserve in a matter of a minutes and saved the entire weekend! We had no problems at all and had a great time. Everything was clean and in working order. I had no problem parking and the location is excellent. I appreciated the quick responses as well. No complaints here, would definitely recommend and use again if I needed to!"
40828178,733885016,2021/2/23,Edwin,­¤Ä¢­¤Ä¢­¤Ä¢­¤Ä¢­¤Ä¢
28400263,5.91E+17,2022/3/25,Christopher,Great stay
6623339,404884782,2019/1/25,Norris,.
3820211,32072682,2015/5/13,Daniel,"Terra was great -- It was my first time using AirBnB and I asked her about 200 questions.<br/><br/>The apartment was really nice - it's located next to a bunch of restaurants and bars.  I only stopped in for one night but was able to get a nice meal and a good beer.<br/><br/>Onsite parking was really convenient.  "
